{
  "schema_version": "1.0",
  "figure_id": "fig-03-cumulative-tokens",
  "purpose": {
    "reader_question": "How does the token difference evolve when donor cost is retained?",
    "expected_reading": "Two cumulative curves include the full donor at zero and all recorded recipients through horizon ten.",
    "claim": "EAL uses fewer cumulative total tokens at each observed horizon, including the donor cost.",
    "scope": "Original resources from GitHub Actions run 36985062352, with AI-only decision coding added by finish run 36997861629 to the same 192 paired trajectories across six selected authored cases, two donor profiles, two recipient profiles and two tool modes; no additional experimental observations or independently validated assessor accuracy.",
    "permitted_inferences": [
      "Descriptive resource contrasts for the explicitly included recorded sessions.",
      "Comparison of recorded quantities under the declared denominators and transformations."
    ],
    "prohibited_inferences": [
      "Population-wide or causal superiority of EAL.",
      "Independent answer correctness, explanation quality, assessor accuracy or reliability from these records.",
      "Net lifecycle cost savings after unmeasured authoring, review, maintenance or acquisition costs."
    ]
  },
  "inputs": [
    {
      "id": "horizons",
      "path": "analysis/cumulative_resources.csv",
      "status": "derived",
      "source_reference": "Recorded resource sums including donor session 0 and recipient sessions 1 through each shown horizon.",
      "sha256": "5b57b55fce052625cf570ae9adf2198ec8bb6c3e9bf9afca17606a0c3fc26ab4"
    }
  ],
  "quantities": [
    {
      "id": "cumtokens",
      "label": "Cumulative total tokens",
      "unit": "million tokens",
      "definition": "Sum of provider input plus output tokens through donor session zero and each recipient horizon.",
      "input_ids": [
        "horizons"
      ],
      "transformation": "Aggregate all 192 trajectories separately by arm and divide tokens by one million for axis labelling.",
      "statistical_role": "derived",
      "status": "available",
      "missingness": {
        "state": "complete",
        "treatment": "All selected recorded resource observations retained; correctness labels excluded from resource calculations."
      },
      "uncertainty": {
        "kind": "unquantified",
        "definition": "Descriptive values for the retained finite selection. No sampling interval or population effect is asserted; provider accounting and clock measurement limitations remain."
      },
      "sample": {
        "denominator": 192,
        "unit": "trajectory per arm",
        "inclusion": "All 192 donor-inclusive trajectories within each arm; the input table contains 384 arm-specific trajectories overall."
      }
    },
    {
      "id": "horizon",
      "label": "Recipient horizon",
      "unit": "recipients",
      "definition": "Number of recipient sessions included after donor session zero, from zero through ten.",
      "input_ids": [
        "horizons"
      ],
      "transformation": "Use the retained integer recipient_horizon field; zero includes only the donor.",
      "statistical_role": "derived",
      "status": "available",
      "missingness": {
        "state": "complete",
        "treatment": "All selected recorded resource observations retained; correctness labels excluded from resource calculations."
      },
      "uncertainty": {
        "kind": "unquantified",
        "definition": "Descriptive values for the retained finite selection. No sampling interval or population effect is asserted; provider accounting and clock measurement limitations remain."
      }
    }
  ],
  "encodings": [
    {
      "id": "horizontal",
      "marks": "positions and connecting line",
      "mark_role": "data_mark",
      "channel": "position",
      "represents": "Horizontal order names the number of recipients included after the donor.",
      "interpretation": "quantitative",
      "quantity_ids": [
        "horizon"
      ],
      "scale_or_mapping": {
        "type": "linear",
        "definition": "Horizontal order names the number of recipients included after the donor.",
        "domain": [
          0,
          10.9
        ]
      }
    },
    {
      "id": "vertical",
      "marks": "positions and connecting line",
      "mark_role": "data_mark",
      "channel": "position",
      "represents": "Vertical position encodes cumulative input plus output tokens in millions; donor included.",
      "interpretation": "quantitative",
      "quantity_ids": [
        "cumtokens"
      ],
      "scale_or_mapping": {
        "type": "linear",
        "definition": "Vertical position encodes cumulative input plus output tokens in millions; donor included.",
        "domain": [
          0,
          3.25
        ]
      }
    }
  ],
  "target": {
    "width_mm": 160,
    "width_mode": "maximum",
    "min_text_pt": 9,
    "min_math_script_pt": 9,
    "min_stroke_pt": 0.4,
    "colour_intent": "colour_and_greyscale",
    "expected_labels": [
      "EAL",
      "Ordinary",
      "Recipient horizon after the donor"
    ],
    "prohibit_block_circle_diagrams": true
  },
  "build": {
    "renderer": "pgfplots",
    "engine": "pdflatex",
    "source": "figures/03-cumulative-tokens.tikz.tex",
    "recipe": [
      [
        "python3",
        "reproduction/build_figures.py"
      ],
      [
        "python3",
        "reproduction/figure-tools/scripts/render_tikz.py",
        "figures/03-cumulative-tokens.tikz.tex",
        "--spec",
        "03-cumulative-tokens.spec.json",
        "--output",
        "figures/03-cumulative-tokens.pdf",
        "--audit",
        "figures/03-cumulative-tokens.audit.json",
        "--preview",
        "figures/03-cumulative-tokens.png",
        "--qa-dir",
        "qa/03-cumulative-tokens"
      ]
    ],
    "outputs": {
      "pdf": "figures/03-cumulative-tokens.pdf",
      "preview": "figures/03-cumulative-tokens.png",
      "audit": "figures/03-cumulative-tokens.audit.json",
      "review": "figures/03-cumulative-tokens.review.json"
    },
    "dependencies": [
      "captions/03-cumulative-tokens.caption.txt"
    ]
  }
}
